answer	qid
Louisiana was adversely affected by Hurricane Gustav.	blogs-03-1
The storm	blogs-03-2
Winds	blogs-03-3
President Bush	blogs-03-4
Once, storm was occurring in Louisiana.	blogs-03-5
to a store named Home Depot in order to purchase a portable generator	blogs-03-6
a large group of pine trees	blogs-03-7
because owned it a group of trees and near the house of narrator the	blogs-03-8
to the house of the parent of the narrator	blogs-03-9
The narrator	blogs-03-10
An area of a neighborhood of the narrator	blogs-03-11
The tree	blogs-03-12
The narrator	blogs-03-13
The narrator began to be concerned because -- if the first tree were to later fall, and were to later fall on the house of the narrator -- the house of the narrator would have begun to be damaged, and the family of the narrator would begin to be wounded.	blogs-03-14
My wife, our five children, and our dog, stayed in an area of the home where we felt safest.	blogs-03-15
on a branch of a tree with a piece of cheese in her beak	fables-01-1
A Crow was sitting on a branch of a tree with a piece of cheese in her beak when a Fox observed her and set his wits to work to discover some way of getting the cheese.	fables-01-2
A Crow was sitting on a branch of a tree with a piece of cheese in her beak when a Fox observed her and set his wits to work to discover some way of getting the cheese.	fables-01-3
The fox snatched the cheese, said that the crow was able to sing and the fox said that the crow needed wits.	fables-01-4
The fox came and stood under the tree.	fables-01-5
that the fox had flattered her	fables-01-6
the fox	fables-01-7
The crow was sitting on a branch of a tree.	fables-01-8
The cheese fell.	fables-01-9
a Fox	fables-01-10
A fox	fables-01-11
that the beauty of the bird was incomparable	fables-01-12
The crow felt that the fox had flattered her and cawed loudly in order for she to show him that she was able to sing.	fables-01-13
A Lion watched a fat Bull feeding in a meadow, and his mouth watered when he thought of the royal feast he would make, but he did not dare to attack him, for he was afraid of his sharp horns.	fables-02-1
The Bull was foolish enough to be persuaded by this flattery to have his horns cut off; and, having now lost his only means of defense, fell an easy prey to the Lion.	fables-02-2
The bull was grazing in a meadow.	fables-02-3
The bull was grazing in a meadow.	fables-02-4
A lion	fables-02-5
that the lion was friendly	fables-02-6
A Lion watched a fat Bull feeding in a meadow, and his mouth watered when he thought of the royal feast he would make, but he did not dare to attack him, for he was afraid of his sharp horns.	fables-02-7
The Bull was foolish enough to be persuaded by this flattery to have his horns cut off; and, having now lost his only means of defense, fell an easy prey to the Lion.	fables-02-8
to eat the bull	fables-02-9
because feared the lion sharp horn every of bull the	fables-02-10
sharp every horn of the bull	fables-02-11
But, my dear friend, what in the world makes you wear those ugly horns?	fables-02-12
A lion	fables-02-13
because wanted the lion to eat the bull	fables-02-14
the bull to remove every horn of the bull because every horn of the bull was ugly	fables-02-15
because ugly every horn of bull the was	fables-02-16
to be hungry	fables-02-17
There once was a fat bull.	fables-02-18
on eventful today	blogs-01-1
A summit meeting named G20 summit started on eventful today.	blogs-01-2
The people protested peacefully on a street.	blogs-01-3
a police car	blogs-01-4
The people	blogs-01-5
The people	blogs-01-6
The people burned a police car and threw a thing at a police.	blogs-01-7
The people	blogs-01-8
a police car	blogs-01-9
Police cars were burned and things were thrown at cops.	blogs-01-10
As things got worse tear gas and bean bag bullets were fired at the rioters while they smash windows of stores.	blogs-01-11
As things got worse tear gas and bean bag bullets were fired at the rioters while they smash windows of stores.	blogs-01-12
windows of stores	blogs-01-13
The police	blogs-01-14
As things got worse tear gas and bean bag bullets were fired at the rioters while they smash windows of stores.	blogs-01-15
because disagreed it about view a	blogs-01-16
riot	blogs-01-17
Police were in full riot gear to alleviate the violence.	blogs-01-18
A Fox	fables-04-1
A Fox invited a Stork to dinner, at which the only fare provided was a large flat dish of soup.	fables-04-2
in a flat and large dish	fables-04-3
A clever fox invited a stork to dine.	fables-04-4
The fox only served some soup in a flat and large dish.	fables-04-5
because able he was n't to reach some food that pitcher was in the	fables-04-6
the long bill of the stork	fables-04-7
for to it was impossible for the him contents reach vessel tempting of the	fables-04-8
The Fox lapped it up with great relish, but the Stork with her long bill tried in vain to partake of the savoury broth.	fables-04-9
The stork	fables-04-10
The stork easily fitted the long bill of the stork into the long and narrow neck of the pitcher.	fables-04-11
A clever fox invited a stork to dine.	fables-04-12
some soup	fables-04-13
The young man	blogs-02-1
on the spot of the yard of the narrator	blogs-02-2
Later, when I was visiting the place where he died, I decided to talk to him as if he were still there because I wanted him to know how bad I felt that I couldnt help him.	blogs-02-3
because wanted it the man young to know the narrator regretting that aided it had not him	blogs-02-4
The narrator entered the house of the narrator and heard that the asleep family of the narrator was asleep.	blogs-02-5
The narrator saw some bright flash in a group of trees that was above the narrator.	blogs-02-6
"At first, my logical mind thought that it was my brother playing around with his new flashlight (not at all like it, but the closest thing I could imagine)
And when I went inside the house, everyone was snoring!"	blogs-02-7
A young man	blogs-02-8
The narrator	blogs-02-9
A young man long ago crashed the motorbike of the young man on the front yard of a narrator and broke the neck of the young man.	blogs-02-10
to wonder that the flash was an orb	blogs-02-11
The narrator saw some bright flash in a group of trees that was above the narrator.	blogs-02-12
A few years ago, a young man died out on my front lawn when he crashed his motorbike.	blogs-02-13
on the front yard of a narrator	blogs-02-14
the young man	blogs-02-15
The narrator	blogs-02-16
The squirrel	blogs-04-1
The squirrel	blogs-04-2
The squirrel 's paw	blogs-04-3
themselves	blogs-04-4
Squirrels	blogs-04-5
But not quite, I saw his one little paw hanging on!	blogs-04-6
I had a digital camera	blogs-04-7
This is one of those times I wish I had a digital camera.	blogs-04-8
on the railing	blogs-04-9
on the deck in order for Benjamin	blogs-04-10
The squirrel approached the bowl.	blogs-04-11
for Benjamin to drink the bowl water 's	blogs-04-12
for birds the to wait	blogs-04-13
a large steel bowl of water	blogs-04-14
An Eagle swooped down upon a Serpent and seized it in his talons with the intention of carrying it off and devouring it.	fables-03-1
An Eagle	fables-03-2
it	fables-03-3
A countryman, who was a witness of the encounter, came to the assistance of the Eagle, and succeeded in freeing him from the Serpent and enabling him to escape.	fables-03-4
The serpent spat some poison in the drinking vessel.	fables-03-5
The serpent spat some poison in the drinking vessel.	fables-03-6
to sip from the drinking vessel	fables-03-7
The eagle	fables-03-8
The eagle spilled the drinking vessel.	fables-03-9
Heated with his exertions, the man was about to slake his thirst with a draught from the horn, when the Eagle knocked it out of his hand, and spilled its contents upon the ground.	fables-03-10
Heated with his exertions, the man was about to slake his thirst with a draught from the horn, when the Eagle knocked it out of his hand, and spilled its contents upon the ground.	fables-03-11
In revenge the Serpent spat some of his poison into the man's drinking-horn.	fables-03-12
An Eagle	fables-03-13
The eagle fought with the serpent, and the serpent coiled around him.	fables-03-14
A countryman, who was a witness of the encounter, came to the assistance of the Eagle, and succeeded in freeing him from the Serpent and enabling him to escape.	fables-03-15
A countryman, who was a witness of the encounter, came to the assistance of the Eagle, and succeeded in freeing him from the Serpent and enabling him to escape.	fables-03-16
a drinking vessel	fables-03-17
A countryman witness	fables-03-18
The eagle escaped, and the countryman freed the eagle from the serpent.	fables-03-19
The serpent spat some poison in the drinking vessel.	fables-03-20
Eagle	fables-03-21
to Miami to visit some friends .	mc500.train.0.1
a salad	mc500.train.0.2
Kristin	mc500.train.0.3
from Atlanta	mc500.train.0.4
Alyssa was happy to spend time with her friends again.	mc500.train.0.5
because tired they were .	mc500.train.0.6
The girls	mc500.train.0.7
she	mc500.train.0.8
The restaurant had a special on catfish.	mc500.train.0.9
fun	mc500.train.0.10
to a restaurant	mc500.train.0.11
at Ellen 's house	mc500.train.0.12
some lemonade to drink	mc500.train.0.13
After eating, the ladies went back to Ellen's house to have fun.	mc500.train.0.14
Alyssa was happy to spend time with her friends again.	mc500.train.0.15
Alyssa got to the beach after a long trip.	mc500.train.0.16
It was Saturday afternoon and Andrew was bored.	mc500.train.23.1
It was Saturday afternoon and Andrew was bored.	mc500.train.23.2
outside the window	mc500.train.23.3
Andrew looked outside the window and saw the newspaper by the door.	mc500.train.23.4
On the front	mc500.train.23.5
He had been watching TV all day.	mc500.train.23.6
the story	mc500.train.23.7
The circus was in town!	mc500.train.23.8
Andrew had never been to the circus.	mc500.train.23.9
your goldfish	mc500.train.23.10
The people and animals at the circus	mc500.train.23.11
"Andrew's dad said, ""I think the newspaper is here."	mc500.train.23.12
at the circus	mc500.train.23.13
to the circus	mc500.train.23.14
The elephant even went down a slide!	mc500.train.23.15
"andrew's dad said, ""i think the newspaper is here. maybe we can find an idea in the newspaper."""	mc500.train.23.16
"Andrew's dad said, ""I think the newspaper is here."	mc500.train.23.17
The elephant	mc500.train.23.18
The people and animals at the circus did lots of tricks.	mc500.train.23.19
it	mc500.train.23.20
Andrew and his dad went to the circus.	mc500.train.23.21
He promised to bring it some peanuts from the circus for later.	mc500.train.23.22
to her back yard	mc500.train.18.1
Kelly woke up one morning and went outside to her back yard.	mc500.train.18.2
Kelly woke up one morning and went outside to her back yard.	mc500.train.18.3
She was going to give her mom the biggest, most beautiful bunch of flowers her mother had ever seen.	mc500.train.18.4
a lot of different flowers	mc500.train.18.5
all of the flowers	mc500.train.18.6
She knew where the best flowers were in her yard.	mc500.train.18.7
in a secret spot	mc500.train.18.8
She was in a hurry because it was Mother's Day and she had to collect flowers before her mom woke up to give to her as a present.	mc500.train.18.9
She was in a hurry because it was Mother's Day and she had to collect flowers before her mom woke up to give to her as a present.	mc500.train.18.10
Finally, her mother woke up at 8:30 AM, and Kelly was excited!	mc500.train.18.11
She was in a hurry because it was Mother's Day and she had to collect flowers before her mom woke up to give to her as a present.	mc500.train.18.12
The red ones were big, the orange ones were small, and the green ones were in the middle.	mc500.train.18.13
them	mc500.train.18.14
Her mother's favorite was the red one.	mc500.train.18.15
Finally, her mother woke up at 8:30 AM, and Kelly was excited!	mc500.train.18.16
After Kelly collected all of the flowers, she went inside and tied them together with string.	mc500.train.18.17
She was in a hurry because it was Mother's Day and she had to collect flowers before her mom woke up to give to her as a present.	mc500.train.18.18
She hoped her baby sister Morgan, who was still in diapers, wouldn't find the flowers and eat them.	mc500.train.18.19
to hide the flowers in spot a secret .	mc500.train.18.20
because Day it was Mother 's and she had to collect flowers before woke her mom up to give to her as present a .	mc500.train.18.21
